{
  "schema_id": "decision_input",
  "schema_version": "0.1.0",
  "vector_id": "TV-0004",
  "vector_name": "containment_trigger",
  "version_pins": {
    "ripplelogic_canon_version": "v8.5.3",
    "sgp_version": "NOT_USED_IN_VECTOR",
    "aligners_sheet_version": "v1.8.3",
    "proofpack_version": "v8.5.3-beta.1"
  },
  "decision_context": {
    "decision_case_id": "CASE-TV-0004",
    "decision_case_type": "CONTAINMENT_TRIGGER",
    "description": "Containment vector where NCRC passes but uncertainty/evidence conditions require containment rather than normal admissible scoring.",
    "evaluation_mode": "PROOFPACK_TEST",
    "actor_scope": [
      "TEST"
    ],
    "time_horizon": "SHORT"
  },
  "alternatives": [
    {
      "alternative_id": "ALT-1",
      "label": "Action option with unresolved severe downside uncertainty",
      "is_target_alternative": true,
      "welfare_impacts": {
        "completeness_status": "PARTIAL_ALLOWED",
        "by_union_dimension": [
          {
            "union": "Self",
            "dimension": "Material",
            "impact_value": "0.10",
            "evidence_quality": "LOW"
          },
          {
            "union": "Community",
            "dimension": "Health",
            "impact_value": "0.15",
            "evidence_quality": "LOW"
          },
          {
            "union": "Biosphere",
            "dimension": "Environment",
            "impact_value": "-0.30",
            "evidence_quality": "LOW"
          }
        ]
      }
    }
  ],
  "weights": {
    "weight_mode": "VECTOR_FIXED_TEST_WEIGHTS",
    "union_weights": [
      {
        "union": "Self",
        "weight": "0.20"
      },
      {
        "union": "Community",
        "weight": "0.40"
      },
      {
        "union": "Biosphere",
        "weight": "0.40"
      }
    ],
    "dimension_weights": [
      {
        "dimension": "Material",
        "weight": "0.20"
      },
      {
        "dimension": "Health",
        "weight": "0.40"
      },
      {
        "dimension": "Environment",
        "weight": "0.40"
      }
    ],
    "normalization_check": {
      "union_weights_sum": "1.00",
      "dimension_weights_sum": "1.00",
      "union_weights_expected_sum": "1.00",
      "dimension_weights_expected_sum": "1.00",
      "normalization_pass_declared": true
    },
    "weight_source": "ProofPack-Lite beta fixed vector weights",
    "weight_notes": "Vector intentionally combines partial data and high-consequence environmental downside uncertainty."
  },
  "rights_coverage": {
    "rights_evaluation_mode": "VECTOR_DECLARED",
    "rights_floor_status": "PASS",
    "rights_violations": [],
    "coverage_sufficiency": "SUFFICIENT",
    "rights_notes": "No explicit NCRC failure. This vector is about containment behavior under risk/evidence limits."
  },
  "uncertainty_profile": {
    "trc_relevance": true,
    "tail_risk_material": true,
    "uncertainty_level": "SEVERE",
    "evidence_sufficiency": "INSUFFICIENT",
    "containment_trigger_expected": true,
    "review_trigger_expected": false
  },
  "uci_structural_input": null,
  "evaluation_options": {
    "emit_primary_decision_path": true,
    "emit_required_flags_only": true,
    "numeric_mode_declared": "fixed_precision_with_disclosed_rounding",
    "rounding_policy_declared": "ROUND_HALF_UP_4DP",
    "strict_schema_mode": true
  },
  "notes": "TV-0004 containment vector. NCRC passes, but severe uncertainty and insufficient evidence should trigger containment as the primary outcome."
}
